{
  "$schema": "urn:openaix:schema:point:0.1.0-draft.2",
  "active": {
    "end": "2026-10-02T15:00:00Z",
    "start": "2026-10-02T13:00:00Z"
  },
  "id": "juniper",
  "name": "Juniper",
  "position": {
    "latitude": 33.59,
    "longitude": 38.552
  },
  "roles": [
    "control"
  ],
  "type": "POINT"
}
